Case number,Description,Missile Velocity (kmps):,Range from Missile Launch to Target (km):,Seeker Max Acquisition Range (km):,Seeker Field of Regard (Degrees):,RMS Target Location Error (TLE) (km):,Nominal Time Between Target Location Updates (s):,Nominal Latency between Location Measurements and IFTU (s):,GPS Jammer ERP (dBW):,GPS CRPA Antenna Peak-to-Sidelobe Level (dB):,IFTU Jammer ERP in-Band (dBW):,IFTU Antenna Frequency Hopping Gain (dB):,IFTU Rx Phased Array Antenna Peak Gain (dBi):,IFTU Rx Phased Array Antenna Peak-to-Sidelobe Level (dB):,Acceleration of Target Evasive Maneuver (g):,Duration of Target Evasive Maneuver (s):,"Max Line-of-Sight Slant Range for Jamming (35 kft, 1 deg grazing, 4/3 scaling):",GPS RMS Position Error (km):,GPS Rx'd Signal Power (dBW):,GPS Jamming J/S Threshold (dB):,GPS Denied?,Offset RMS Position Error (km):,IFTU Denied?
1,P(Y) Code GPS with Omni; IFTU with Omni; TLE 0.2 km,0.281741,1000,50,10,0.2,300,100,40,0,40,10,0,0,0.5,10,555.23,0.0102,-160,54,0,0,0
2,P(Y) Code GPS with Omni; IFTU with Omni; TLE 0.1 km,0.281741,1000,50,10,0.1,300,100,40,0,40,10,0,0,0.5,10,555.23,0.0102,-160,54,0,0,0
3,                M Code (Spot) GPS with Omni; IFTU with Phased Array; TLE 0.2 km,0.281741,1000,50,10,0.2,300,100,40,0,40,10,10,10,0.5,10,555.23,0.0034,-138,54,0,0,0
4,M Code (Spot) GPS with Omni; IFTU with Phased Array; TLE 0.1 km,0.281741,1000,50,10,0.1,300,100,40,0,40,10,10,10,0.5,10,555.23,0.0034,-138,54,0,0,0
5,                GPS Denied; IFTU with Phased Array; TLE 0.1 km,0.281741,500,50,10,0.1,300,100,40,0,40,10,10,10,0.5,10,555.23,0.0034,-138,54,1,0,0
6,                M Code (Spot) GPS with Omni; IFTU denied; TLE 0.2 km,0.281741,1000,50,10,0.2,300,100,40,0,40,10,10,10,0.5,10,555.23,0.0034,-138,54,0,0,1
